{
 "version": "1.1",
 "status": "ready",
 "source_video_path": "projects/etf-100k-four-fund-race/renders/final.mp4",
 "primary_cover": {
  "id": "cover-primary",
  "path": "projects/etf-100k-four-fund-race/assets/images/cover.png",
  "format": "png",
  "width": 1080,
  "height": 1440,
  "aspect_ratio": "3:4",
  "role": "primary",
  "source_tool": "pillow",
  "provider": "local",
  "cost_usd": 0.0,
  "text_overlay": [
   "2020.07.03 → 2026.09.18 · 1510 个交易日 · 后复权口径",
   "10 万元买 4 只 ETF",
   "6 年后差多少？",
   "起点 ¥100,000",
   "红利低波50 ¥193,622",
   "红利低波100 ¥181,596",
   "中证500 ¥142,111",
   "沪深300 ¥112,681",
   "同样的起点，期末最好与最差相差",
   "¥80,941",
   "数据回顾，不构成投资建议 · 历史数据不代表未来"
  ]
 },
 "variants": [
  {
   "id": "cover-thumb-check",
   "path": "projects/etf-100k-four-fund-race/assets/images/cover_thumb_check.png",
   "format": "png",
   "width": 270,
   "height": 360,
   "aspect_ratio": "3:4",
   "role": "variant",
   "source_tool": "pillow",
   "provider": "local",
   "cost_usd": 0.0,
   "text_overlay": [
    "2020.07.03 → 2026.09.18 · 1510 个交易日 · 后复权口径",
    "10 万元买 4 只 ETF",
    "6 年后差多少？",
    "起点 ¥100,000",
    "红利低波50 ¥193,622",
    "红利低波100 ¥181,596",
    "中证500 ¥142,111",
    "沪深300 ¥112,681",
    "同样的起点，期末最好与最差相差",
    "¥80,941",
    "数据回顾，不构成投资建议 · 历史数据不代表未来"
   ]
  }
 ],
 "creative_rationale": "封面只用这支片子真正拍出来的东西：同一张归一化竞速图（四条账户资产曲线、¥100,000 起跑线、线下水下带）、四个期末金额，以及期末极差 ¥80,941。没有生成图、没有素材照、没有片子没讲的结论。四条身份色在两行 chip 里以极小色块出现，与名称、金额同排，颜色永远不是唯一识别通道；金额本身用墨色而非身份色——身份色是为区分所选、不是为可读所选，中证500 的橙对底板只有 2.98:1，改用墨色后 14.08:1。",
 "decision_log_ref": "projects/etf-100k-four-fund-race/artifacts/decision_log.json",
 "generation_policy": "non_codex_host",
 "cover_approach": "composited",
 "visual_source": {
  "kind": "local_composition",
  "source_tool": "pillow",
  "provider": "local",
  "path": "projects/etf-100k-four-fund-race/assets/images/cover.png",
  "prompt": ""
 },
 "verification": {
  "file_exists": true,
  "dimensions_match": true,
  "text_checked": true,
  "mobile_readability_checked": true,
  "content_match": true,
  "issues": []
 },
 "metadata": {
  "content_category": "finance",
  "checks_detail": {
   "dimensions": "1080x1440（3:4）",
   "thumbnail": "270x360 降采样后，标题、四个期末金额与 ¥80,941 仍可辨认",
   "numbers_read_by_human": [
    "¥193,622",
    "¥181,596",
    "¥142,111",
    "¥112,681",
    "¥80,941",
    "¥100,000"
   ],
   "numbers_source": "artifacts/etf_data.json（同一份基准数据，未人工转写）",
   "contrast_measured": {
    "note": "四个期末金额与 ¥80,941 均取墨色 #22201C，对封面底板（实测 #EEEFFB≈238,239,235）对比度 14.08:1。",
    "before": "四个金额曾用身份色染色；其中中证500 的 #C4791F 对底板仅 2.98:1，低于大字 3:1 的下限。",
    "after": "统一改为墨色，四个金额对比度一致为 14.08:1；身份由色块 + 名称 + 金额同排承担。"
   },
   "watermark": "none（本地确定性绘制）",
   "claims_on_cover_are_in_film": true
  },
  "text_is_native": true,
  "chinese_text_engine": "Pillow + PingFang.ttc（确定性排版；文字不是生成图的一部分）",
  "brand_marks": "无系列名、无期号、无角标（用户选择独立单条）",
  "cover_dates": "2020-07-03 至 2026-09-18",
  "plan_change": {
   "from": "host_imagegen_plus_native",
   "to": "pure_deterministic_composite",
   "logged_decision_id": "d-011",
   "reason": "① 封面核心视觉必须与成片同源，生成图无法复现曲线几何与数字；② 材质底板不承载信息，却带来图像生成额度消耗与水印风险；③ 完全确定性合成让每一个像素都可核对。",
   "not_a_downgrade": true,
   "note": "这不是对硬性规则的绕过：cover_defaults.codex_primary_visual_required 只适用于 Codex 会话，本机为非 Codex 宿主，因此未使用 override 字段。该变更降低了能力使用量，已作为 d-011 追加记录，并会在交付说明中向用户上报。"
  }
 }
}